<?xml version="1.0" encoding="UTF-8"?>
<!DOCTYPE socios [
   <!ELEMENT socios (socio)*>
   <!ELEMENT socio ((numero, clave)+, nombre, edad?)>
   <!ELEMENT clave (#PCDATA)>
   <!ELEMENT edad (#PCDATA)>
   <!ELEMENT nombre (#PCDATA)>
   <!ELEMENT numero (#PCDATA)>
]>

<socios>
   <socio>
      <numero>5982</numero>
      <clave>fdsa</clave>
      <nombre>Ana</nombre>
      <edad>21</edad>
   </socio>
   <socio>       
      <numero>5983</numero>
      <clave>55d5d</clave>
      <nombre>Iker</nombre>
      <edad>19</edad>
   </socio>
   <socio>
      <numero>5654</numero>
      <clave>hY75Du</clave>
      <nombre>Iker</nombre>
   </socio>
</socios>